,Ticker,Name,Last Sale,Net Change,% Change,Market Cap
1755,MPT,"Medical Properties Trust, Inc. common stock",$5.24,0.04,0.769%,"3,151,860,000"
1756,GBTG,"Global Business Travel Group, Inc. Class A Common Stock",$6.01,-0.14,-2.276%,"3,146,392,059"
1757,WU,Western Union Company (The) Common Stock,$9.88,0.48,5.106%,"3,140,307,661"
1758,COCO,"The Vita Coco Company, Inc. Common Stock",$55.00,-2.56,-4.448%,"3,132,154,190"
1759,MARA,"MARA Holdings, Inc. Common Stock",$8.28,-0.77,-8.508%,"3,131,366,443"
1760,SPSC,"SPS Commerce, Inc. Common Stock",$82.60,0.57,0.695%,"3,114,771,164"
1761,XMTR,"Xometry, Inc. Class A Common Stock",$60.70,-1.15,-1.859%,"3,110,732,719"
1762,OPLN,"OPENLANE, Inc. Common Stock",$29.25,-0.15,-0.51%,"3,108,198,220"
1763,NMIH,NMI Holdings Inc. Common Stock,$40.31,1.59,4.106%,"3,098,546,178"
1764,CPK,Chesapeake Utilities Corporation Common Stock,$130.88,2.23,1.733%,"3,095,401,522"
1765,OII,"Oceaneering International, Inc. Common Stock",$30.97,-0.43,-1.369%,"3,090,038,285"
1766,HAE,Haemonetics Corporation Common Stock,$65.95,1.09,1.681%,"3,087,097,868"
1767,HTGC,"Hercules Capital, Inc. Common Stock",$16.98,-0.53,-3.027%,"3,085,572,914"
1768,IRON,"Disc Medicine, Inc. Common Stock",$81.65,1.94,2.434%,"3,082,300,727"
1769,CAKE,Cheesecake Factory Incorporated (The) Common Stock,$61.82,2.00,3.343%,"3,081,213,276"
1770,SFNC,Simmons First National Corporation Class A Common Stock,$21.29,0.32,1.526%,"3,081,037,725"
1771,CPRX,"Catalyst Pharmaceuticals, Inc. Common Stock",$25.06,-0.16,-0.634%,"3,080,184,418"
1772,SA,"Seabridge Gold, Inc. Ordinary Shares (Canada)",$29.56,-0.08,-0.27%,"3,069,576,467"
1773,SII,Sprott Inc. Common Shares,$118.91,-4.97,-4.012%,"3,067,878,000"
1774,CORZW,"Core Scientific, Inc. Tranche 1 Warrants",$9.87,-1.42,-12.578%,"3,060,305,031"
1775,LEGN,Legend Biotech Corporation American Depositary Shares,$16.65,-0.01,-0.06%,"3,057,758,481"
1776,TGNA,TEGNA Inc,$18.92,0.11,0.585%,"3,047,194,448"
1777,BANC,"Banc of California, Inc. Common Stock",$20.13,0.25,1.258%,"3,045,743,260"
1778,PFS,"Provident Financial Services, Inc Common Stock",$23.30,0.32,1.393%,"3,043,501,547"
1779,HAFN,Hafnia Limited Common Shares,$6.11,-0.09,-1.452%,"3,042,716,713"
1780,TPH,"Tri Pointe Homes, Inc. Common Stock",$35.35,1.66,4.927%,"3,038,456,119"
1781,CSQ,Calamos Strategic Total Return Common Stock,$19.12,-0.16,-0.83%,"3,037,931,333"
1782,BOH,Bank of Hawaii Corporation Common Stock,$76.33,1.16,1.543%,"3,036,796,072"
1783,MANU,Manchester United Ltd. Class A Ordinary Shares,$17.60,0.20,1.149%,"3,034,747,918"
1784,SLG,SL Green Realty Corp Common Stock,$42.48,0.32,0.759%,"3,017,179,637"
1785,TGB,"Taseko Mines, Ltd. Common Stock",$8.37,-0.46,-5.21%,"3,016,638,195"
1786,CXT,"Crane NXT, Co. Common Stock",$52.51,1.12,2.179%,"3,015,231,268"
1787,PTEN,"Patterson-UTI Energy, Inc. Common Stock",$7.95,0.14,1.793%,"3,014,974,091"
1788,EWTX,"Edgewise Therapeutics, Inc. Common Stock",$28.47,-1.18,-3.98%,"3,014,074,316"
1789,PVH,PVH Corp. Common Stock,$65.65,3.43,5.513%,"3,006,946,992"
1790,ALM,Almonty Industries Inc. Common Shares,$13.36,-0.03,-0.224%,"3,003,483,083"
1791,COTY,Coty Inc. Class A Common Stock,$3.43,0.27,8.544%,"2,999,938,629"
1792,VRRM,Verra Mobility Corporation Class A Common Stock,$18.79,0.70,3.87%,"2,998,215,959"
1793,ITGR,Integer Holdings Corporation Common Stock,$85.52,-0.52,-0.604%,"2,996,486,192"
1794,EEFT,"Euronet Worldwide, Inc. Common Stock",$70.98,3.26,4.814%,"2,984,331,457"
1795,MGRC,McGrath RentCorp Common Stock,$120.86,4.21,3.609%,"2,974,564,865"
1796,FFBC,First Financial Bancorp. Common Stock,$30.12,0.66,2.24%,"2,967,474,387"
1797,LXP,LXP Industrial Trust Common Stock (Maryland REIT),$50.14,-0.15,-0.298%,"2,966,224,488"
1798,ATS,ATS Corporation Common Shares,$30.25,1.86,6.552%,"2,966,188,827"
1799,CNK,"Cinemark Holdings Inc Cinemark Holdings, Inc. Common Stock",$25.20,0.52,2.107%,"2,960,392,730"
1800,ZIONP,"Zions Bancorporation, N.A. Depositary Shares (Each representing 1/40th Interest in a Share of Series A Floating-Rate Non-Cumulative Perpetual Preferred Stock)",$20.04,0.07,0.351%,"2,958,726,321"
1801,KWR,Quaker Houghton Common Stock,$170.50,8.03,4.942%,"2,956,475,968"
1802,ASH,Ashland Inc. Common Stock,$64.57,3.49,5.714%,"2,954,858,732"
1803,NMRK,"Newmark Group, Inc. Class A Common Stock",$16.36,0.08,0.491%,"2,951,546,979"
1804,TWST,Twist Bioscience Corporation Common Stock,$48.12,1.80,3.886%,"2,950,319,196"
1805,DYN,"Dyne Therapeutics, Inc. Common Stock",$18.23,-0.73,-3.85%,"2,945,853,625"
1806,CON,"Concentra Group Holdings Parent, Inc. Common Stock",$22.95,0.14,0.614%,"2,941,506,136"
1807,BWIN,"The Baldwin Insurance Group, Inc. Class A Common Stock",$20.62,0.12,0.585%,"2,940,063,233"
1808,MGEE,"MGE Energy, Inc",$80.28,1.11,1.402%,"2,933,579,638"
1809,SXI,Standex International Corporation Common Stock,$241.94,-6.13,-2.471%,"2,932,006,262"
1810,APLS,"Apellis Pharmaceuticals, Inc. Common Stock",$23.15,-0.17,-0.729%,"2,929,058,797"
1811,GT,The Goodyear Tire & Rubber Company Common Stock,$10.22,0.26,2.61%,"2,924,564,490"
1812,KMT,Kennametal Inc. Common Stock,$38.35,2.59,7.243%,"2,918,171,766"
1813,IDYA,"IDEAYA Biosciences, Inc. Common Stock",$33.28,-0.95,-2.775%,"2,917,538,058"
1814,IMNM,"Immunome, Inc. Common Stock",$26.41,-0.56,-2.076%,"2,913,866,747"
1815,KLIC,"Kulicke and Soffa Industries, Inc. Common Stock",$55.67,-1.53,-2.675%,"2,913,356,733"
1816,INSW,"International Seaways, Inc. Common Stock",$58.96,-2.06,-3.376%,"2,912,864,439"
1817,BRSL,"Brightstar Lottery PLC Trading under the Legal Name to begin at the market open on July 21, 2025. Ordinary Shares",$14.39,0.21,1.481%,"2,907,235,228"
1818,OLN,Olin Corporation Common Stock,$25.44,2.51,10.946%,"2,903,251,698"
1819,VRDN,"Viridian Therapeutics, Inc. Common Stock",$30.37,-1.53,-4.796%,"2,898,573,783"
1820,AMBP,Ardagh Metal Packaging S.A. Ordinary Shares,$4.84,0.20,4.31%,"2,892,865,996"
1821,MRX,Marex Group plc Ordinary Shares,$40.20,1.21,3.103%,"2,882,336,864"
1822,APLE,"Apple Hospitality REIT, Inc. Common Shares",$12.14,0.32,2.707%,"2,872,028,901"
1823,HIW,"Highwoods Properties, Inc. Common Stock",$25.99,0.40,1.563%,"2,856,143,553"
1824,PLUG,"Plug Power, Inc. Common Stock",$2.05,-0.08,-3.756%,"2,855,432,427"
1825,WOR,"Worthington Enterprises, Inc. Common Shares",$57.60,0.78,1.373%,"2,853,883,066"
1826,VCYT,"Veracyte, Inc. Common Stock",$36.10,-1.64,-4.346%,"2,853,675,145"
1827,HURN,Huron Consulting Group Inc. Common Stock,$165.47,-0.15,-0.091%,"2,852,945,710"
1828,HE,"Hawaiian Electric Industries, Inc. Common Stock",$16.47,0.59,3.715%,"2,843,059,240"
1829,NATL,NCR Atleos Corporation Common Stock,$38.44,0.38,0.998%,"2,840,874,988"
1830,CVBF,CVB Financial Corporation Common Stock,$20.75,0.39,1.916%,"2,838,788,161"
1831,BKV,BKV Corporation Common Stock,$29.27,0.66,2.307%,"2,838,380,538"
1832,TR,"Tootsie Roll Industries, Inc. Common Stock",$38.86,0.37,0.961%,"2,836,260,442"
1833,TVTX,"Travere Therapeutics, Inc. Common Stock",$31.68,-1.16,-3.532%,"2,834,483,319"
1834,DKL,"Delek Logistics Partners, L.P. Common Units representing Limited Partner Interests",$52.88,1.36,2.64%,"2,828,043,605"
1835,KYIV,Kyivstar Group Ltd. Common Shares,$11.85,0.02,0.169%,"2,826,582,301"
1836,DRD,DRDGOLD Limited American Depositary Shares,$32.68,-0.03,-0.092%,"2,825,475,904"
1837,MSGE,Madison Square Garden Entertainment Corp. Class A Common Stock,$59.81,-0.53,-0.878%,"2,824,928,396"
1838,POWWP,Outdoor Holding Company 8.75% Series A Cumulative Redeemable Perpetual Preferred Stock,$24.11,-0.04,-0.166%,"2,823,542,039"
1839,DBRG,"DigitalBridge Group, Inc.",$15.45,UNCH,--,"2,822,319,866"
1840,PRK,Park National Corporation Common Stock,$175.27,4.06,2.371%,"2,818,036,981"
1841,SHOO,"Steven Madden, Ltd. Common Stock",$38.76,-3.46,-8.195%,"2,816,221,638"
1842,SUPN,"Supernus Pharmaceuticals, Inc. Common Stock",$49.08,0.68,1.405%,"2,814,215,298"
1843,ABM,ABM Industries Incorporated Common Stock,$46.62,0.97,2.125%,"2,805,480,878"
1844,UAA,"Under Armour, Inc. Class A Common Stock",$6.61,0.37,5.929%,"2,801,908,683"
1845,RXO,"RXO, Inc. Common Stock",$17.05,1.11,6.964%,"2,798,107,418"
1846,VTMX,"Corporacion Inmobiliaria Vesta, S.A.B de C.V. American Depositary Shares, each representing ten (10) Common Shares",$31.63,0.12,0.381%,"2,797,630,610"
1847,VRNS,"Varonis Systems, Inc. Common Stock",$23.67,-2.86,-10.78%,"2,790,629,280"
1848,AERO,"Grupo Aeromexico, S.A.B. de C.V. American Depositary Shares (each representing ten (10) Common Shares)",$19.11,-1.04,-5.161%,"2,788,214,146"
1849,TOWN,TowneBank Common Stock,$37.23,0.82,2.252%,"2,778,003,196"
1850,DRVN,Driven Brands Holdings Inc. Common Stock,$16.89,0.89,5.563%,"2,777,631,742"
1851,AWR,American States Water Company Common Stock,$71.69,0.08,0.112%,"2,775,437,200"
1852,BATRA,"Atlanta Braves Holdings, Inc. Series A Common Stock",$44.06,0.27,0.617%,"2,772,401,479"
1853,IAC,IAC Inc. Common Stock,$35.69,-1.11,-3.016%,"2,763,585,340"
1854,CARG,"CarGurus, Inc. Class A Common Stock",$28.95,-0.53,-1.798%,"2,763,370,256"
1855,VNET,"VNET Group, Inc. American Depositary Shares",$10.27,-0.59,-5.433%,"2,762,896,003"
1856,FTAIM,FTAI Aviation Ltd. 9.500% Fixed-Rate Reset Series D Cumulative Perpetual Redeemable Preferred Shares,$26.92,-0.1264,-0.467%,"2,761,263,141"
1857,UA,"Under Armour, Inc. Class C Common Stock",$6.51,0.38,6.199%,"2,759,519,747"
1858,SUNC,"SunocoCorp LLC Common Units, representing limited liability company interests",$53.47,-0.15,-0.28%,"2,754,624,577"
1859,ALMS,Alumis Inc. Common Stock,$26.35,-0.69,-2.552%,"2,750,766,169"
1860,NAVN,"Navan, Inc. Class A Common Stock",$11.06,0.72,6.963%,"2,750,003,359"
1861,DIOD,Diodes Incorporated Common Stock,$59.28,0.90,1.542%,"2,749,722,422"
1862,VC,Visteon Corporation Common Stock,$100.75,3.79,3.909%,"2,749,056,642"
1863,PHIN,PHINIA Inc. Common Stock,$71.43,0.16,0.224%,"2,745,960,204"
1864,IHS,IHS Holding Limited Ordinary Shares,$8.23,-0.41,-4.745%,"2,744,218,912"
1865,WBI,WaterBridge Infrastructure LLC Class A Shares Representing Limited Liability Company Interests,$22.22,0.27,1.23%,"2,743,170,100"
1866,BEAM,Beam Therapeutics Inc. Common Stock,$26.95,-0.94,-3.37%,"2,734,749,741"
1867,IE,Ivanhoe Electric Inc. Common Stock,$18.87,-0.97,-4.889%,"2,730,767,842"
1868,AAOI,"Applied Optoelectronics, Inc. Common Stock",$39.90,-6.22,-13.487%,"2,724,308,838"
1869,TNET,"TriNet Group, Inc. Common Stock",$56.65,-1.27,-2.193%,"2,720,919,951"
1870,AKR,Acadia Realty Trust Common Stock,$20.75,0.69,3.44%,"2,718,968,448"
1871,BTE,Baytex Energy Corp Common Shares,$3.53,0.01,0.284%,"2,712,159,010"
1872,PRVA,"Privia Health Group, Inc. Common Stock",$22.01,-0.43,-1.916%,"2,707,263,653"
1873,HWKN,"Hawkins, Inc. Common Stock",$129.28,2.56,2.02%,"2,702,222,583"
1874,CALY,Callaway Golf Company Common Stock,$14.69,0.21,1.45%,"2,701,250,628"
1875,TMC,TMC the metals company Inc. Common Stock,$6.53,-0.59,-8.287%,"2,700,103,054"
1876,TARS,"Tarsus Pharmaceuticals, Inc. Common Stock",$63.51,-3.35,-5.01%,"2,695,942,659"
1877,LFST,"LifeStance Health Group, Inc. Common Stock",$6.93,-0.18,-2.532%,"2,695,771,947"
1878,VSH,"Vishay Intertechnology, Inc. Common Stock",$19.86,-0.88,-4.243%,"2,692,785,525"
1879,CMBT,CMB.TECH NV Ordinary Shares,$12.23,-0.53,-4.154%,"2,690,902,240"
1880,RELY,"Remitly Global, Inc. Common Stock",$12.87,0.50,4.042%,"2,690,421,132"
1881,CC,Chemours Company (The) Common Stock,$17.94,1.42,8.596%,"2,689,061,619"
1882,AMR,"Alpha Metallurgical Resources, Inc. Common Stock",$208.76,-2.13,-1.01%,"2,684,241,090"
1883,BELFB,Bel Fuse Inc. Class B Common Stock,$211.58,-5.67,-2.61%,"2,678,721,920"
1884,NMFCZ,New Mountain Finance Corporation 8.250% Notes due 2028,$25.18,UNCH,--,"2,678,168,998"
1885,CWT,California Water Service Group Common Stock,$44.94,0.49,1.102%,"2,678,034,865"
1886,CUBI,"Customers Bancorp, Inc Common Stock",$78.34,UNCH,--,"2,676,727,152"
1887,ARX,Accelerant Holdings Class A Common Shares,$12.06,0.30,2.551%,"2,675,149,731"
1888,FRSH,Freshworks Inc. Class A Common Stock,$9.47,-0.06,-0.63%,"2,670,272,501"
1889,BL,"BlackLine, Inc. Common Stock",$44.88,0.45,1.013%,"2,669,761,660"
1890,GLOB,Globant S.A. Common Shares,$60.40,2.31,3.977%,"2,660,351,703"
1891,ATRO,Astronics Corporation Common Stock,$74.37,-6.03,-7.50%,"2,649,737,729"
1892,TBBK,The Bancorp Inc Common Stock,$60.24,-0.39,-0.643%,"2,645,597,850"
1893,ADPT,Adaptive Biotechnologies Corporation Common Stock,$17.30,-1.20,-6.486%,"2,641,107,752"
1894,FCPT,"Four Corners Property Trust, Inc. Common Stock",$24.88,0.37,1.51%,"2,639,320,483"
1895,TRMK,Trustmark Corporation Common Stock,$43.84,0.49,1.13%,"2,628,569,899"
1896,MLCO,Melco Resorts & Entertainment Limited American Depositary Shares,$6.17,0.11,1.815%,"2,625,418,054"
1897,FTAIN,FTAI Aviation Ltd. 8.25% Fixed - Rate Reset Series C Cumulative Perpetual Redeemable Preferred Shares,$25.5615,-0.0185,-0.072%,"2,621,917,822"
1898,HNGE,"Hinge Health, Inc. Class A Common Stock",$33.25,0.18,0.544%,"2,617,420,516"
1899,AMBA,"Ambarella, Inc. Ordinary Shares",$60.75,0.52,0.863%,"2,615,317,025"
1900,POWI,"Power Integrations, Inc. Common Stock",$47.25,2.01,4.443%,"2,614,633,655"
1901,CLSK,"CleanSpark, Inc. Common Stock",$10.22,-1.14,-10.035%,"2,613,768,689"
1902,SBLK,Star Bulk Carriers Corp. Common Shares,$22.30,-0.29,-1.284%,"2,611,943,941"
1903,CURB,Curbline Properties Corp. Common Stock,$24.73,0.28,1.145%,"2,605,753,608"
1904,SID,Companhia Siderurgica Nacional S.A. Common Stock,$1.96,-0.05,-2.488%,"2,599,144,136"
1905,GDV,Gabelli Dividend & Income Trust Common Shares of Beneficial Interest,$28.80,0.16,0.559%,"2,597,428,541"
1906,NGVT,Ingevity Corporation Common Stock,$72.17,2.40,3.44%,"2,595,524,189"
1907,ZIM,ZIM Integrated Shipping Services Ltd. Ordinary Shares,$21.53,-0.23,-1.057%,"2,593,450,190"
1908,CHEF,"The Chefs' Warehouse, Inc. Common Stock",$63.60,-0.67,-1.042%,"2,587,600,916"
1909,MFAO,"MFA Financial, Inc. 9.000% Senior Notes due 2029",$25.18,-0.04,-0.159%,"2,585,197,916"
1910,UE,Urban Edge Properties Common Shares of Beneficial Interest,$20.52,0.54,2.703%,"2,582,517,390"
1911,WAFD,"WaFd, Inc. Common Stock",$33.65,0.33,0.99%,"2,580,988,717"
1912,BKE,"Buckle, Inc. (The) Common Stock",$50.45,1.46,2.98%,"2,580,851,782"
1913,HCM,HUTCHMED (China) Limited American Depositary Shares,$14.78,0.39,2.71%,"2,578,133,545"
1914,MTRN,Materion Corporation,$151.63,6.62,4.565%,"2,574,354,883"
1915,LION,Lionsgate Studios Corp Common Shares,$8.88,-0.10,-1.114%,"2,572,796,308"
1916,MFAN,"MFA Financial, Inc. 8.875% Senior Notes due 2029",$25.00,-0.14,-0.557%,"2,566,717,550"
1917,BBT,Beacon Financial Corporation Common stock,$30.52,1.12,3.81%,"2,560,898,438"
1918,OI,"O-I Glass, Inc. Common Stock",$16.57,0.83,5.273%,"2,545,061,031"
1919,ACLS,"Axcelis Technologies, Inc. Common Stock",$82.76,-1.61,-1.908%,"2,540,665,875"
1920,NSIT,"Insight Enterprises, Inc. Common Stock",$81.65,2.59,3.276%,"2,529,484,095"
1921,TDC,Teradata Corporation Common Stock,$27.14,1.11,4.264%,"2,529,448,000"
1922,BRBR,"BellRing Brands, Inc. Common Stock",$21.11,0.23,1.102%,"2,526,277,609"
1923,CRVL,CorVel Corp. Common Stock,$49.08,-2.50,-4.847%,"2,515,200,257"
1924,SAM,"Boston Beer Company, Inc. (The) Common Stock",$235.66,12.17,5.445%,"2,511,751,003"
1925,FBNC,First Bancorp Common Stock,$60.52,0.98,1.646%,"2,509,481,711"
1926,NSA,National Storage Affiliates Trust Common Shares of Beneficial Interest,$32.58,0.43,1.337%,"2,507,381,789"
1927,XRAY,DENTSPLY SIRONA Inc. Common Stock,$12.54,0.54,4.50%,"2,502,381,691"
1928,BATRK,"Atlanta Braves Holdings, Inc. Series C Common Stock",$39.76,0.17,0.429%,"2,501,831,203"
1929,WB,Weibo Corporation American Depositary Share,$10.18,-0.07,-0.683%,"2,492,321,350"
1930,FLO,"Flowers Foods, Inc. Common Stock",$11.80,0.59,5.263%,"2,491,903,055"
1931,SYRE,"Spyre Therapeutics, Inc. Common Stock",$32.07,-1.22,-3.665%,"2,488,379,609"
1932,RUM,Rumble Inc. Class A Common Stock,$5.72,0.05,0.882%,"2,487,413,060"
1933,VERX,"Vertex, Inc. Class A Common Stock",$15.58,-0.29,-1.827%,"2,485,445,679"
1934,BWNB,"Babcock & Wilcox Enterprises, Inc. 6.50% Senior Notes due 2026",$24.58,0.04,0.163%,"2,484,977,582"
1935,DBD,Diebold Nixdorf Incorporated Common stock,$69.13,-1.86,-2.62%,"2,479,496,494"
1936,CPRI,Capri Holdings Limited Ordinary Shares,$20.75,0.67,3.337%,"2,472,223,019"
1937,SDRL,Seadrill Limited Common Shares,$39.61,0.82,2.114%,"2,470,640,913"
1938,NOG,"Northern Oil and Gas, Inc. Common Stock",$25.31,0.81,3.306%,"2,470,331,373"
1939,PTON,"Peloton Interactive, Inc. Class A Common Stock",$5.91,0.19,3.322%,"2,469,236,250"
1940,WSBCO,"WesBanco, Inc. Depositary Shares each representing 1/40th interest in a share of 7.375% Fixed-Rate Reset Non-Cumulative Perpetual Preferred Stock, Series B",$25.70,UNCH,--,"2,468,365,418"
1941,WGS,GeneDx Holdings Corp. Class A Common Stock,$85.35,-9.88,-10.375%,"2,467,006,757"
1942,ARCB,ArcBest Corporation Common Stock,$109.55,5.81,5.601%,"2,466,082,351"
1943,ALG,"Alamo Group, Inc. Common Stock",$203.23,7.71,3.943%,"2,462,218,432"
1944,CTRI,"Centuri Holdings, Inc. Common Stock",$27.77,-0.77,-2.698%,"2,461,787,007"
1945,ATHM,"Autohome Inc. American Depositary Shares, each representing four class A ordinary shares.",$20.76,-0.17,-0.812%,"2,458,891,939"
1946,BTDR,Bitdeer Technologies Group Class A Ordinary Shares,$12.48,-0.48,-3.704%,"2,455,391,940"
1947,CECO,CECO Environmental Corp. Common Stock,$68.85,-2.01,-2.837%,"2,453,884,984"
1948,ZGN,Ermenegildo Zegna N.V. Ordinary Shares,$9.71,0.40,4.296%,"2,452,550,625"
1949,AGYS,"Agilysys, Inc. Common Stock (DE)",$86.875,3.005,3.583%,"2,441,903,958"
1950,BWLP,BW LPG Limited Common Shares,$16.06,0.12,0.753%,"2,433,707,395"
1951,BELFA,Bel Fuse Inc. Class A Common Stock,$192.11,-7.29,-3.656%,"2,432,220,758"
1952,NAMSW,NewAmsterdam Pharma Company N.V. Warrant,$21.41,1.41,7.05%,"2,427,697,114"
1953,TPB,"Turning Point Brands, Inc. Common Stock",$127.13,0.46,0.363%,"2,424,465,337"
1954,MLYS,"Mineralys Therapeutics, Inc. Common Stock",$30.62,-0.94,-2.978%,"2,423,265,453"
1955,HOG,"Harley-Davidson, Inc. Common Stock",$20.51,0.59,2.962%,"2,423,089,610"
1956,DXC,DXC Technology Company Common Stock,$14.25,0.75,5.556%,"2,419,079,473"
1957,FRME,First Merchants Corporation Common Stock,$41.82,1.01,2.475%,"2,418,242,336"
1958,TXG,"10x Genomics, Inc. Class A Common Stock",$19.06,-0.22,-1.141%,"2,412,101,152"
1959,CEPU,Central Puerto S.A. American Depositary Shares (each represents ten Common Shares),$15.92,-0.54,-3.281%,"2,410,323,438"
1960,NBTB,NBT Bancorp Inc. Common Stock,$46.06,0.81,1.79%,"2,409,637,790"
1961,HTH,Hilltop Holdings Inc.,$39.24,0.63,1.632%,"2,406,531,792"
1962,MH,"McGraw Hill, Inc. Common Stock",$12.57,-0.48,-3.678%,"2,400,889,094"
1963,CVI,CVR Energy Inc. Common Stock,$23.88,0.54,2.314%,"2,400,670,704"
1964,WVE,Wave Life Sciences Ltd. Ordinary Shares,$13.33,-0.37,-2.701%,"2,399,124,122"
1965,HTFL,"Heartflow, Inc. Common Stock",$28.14,-0.25,-0.881%,"2,396,366,353"
1966,GSHD,"Goosehead Insurance, Inc. Class A Common Stock",$64.99,4.62,7.653%,"2,394,509,107"
1967,TLX,Telix Pharmaceuticals Limited American Depositary Shares,$7.13,-0.01,-0.14%,"2,386,585,578"
1968,HUN,Huntsman Corporation Common Stock,$13.73,0.75,5.778%,"2,385,601,587"
1969,CNXC,Concentrix Corporation Common Stock,$38.71,1.40,3.752%,"2,384,431,638"
1970,RARE,Ultragenyx Pharmaceutical Inc. Common Stock,$24.69,-0.11,-0.444%,"2,382,031,179"
1971,TRN,"Trinity Industries, Inc. Common Stock",$29.66,0.37,1.263%,"2,378,154,312"
1972,TRMD,TORM plc Class A Common Stock,$24.29,-0.42,-1.70%,"2,375,903,299"
1973,SPNT,SiriusPoint Ltd. Common Shares,$20.29,0.10,0.495%,"2,370,169,046"
1974,MFICL,MidCap Financial Investment Corporation 8.00% Notes due 2028,$25.3995,0.0394,0.155%,"2,369,865,347"
1975,IVT,InvenTrust Properties Corp. Common Stock,$30.51,0.63,2.108%,"2,368,167,284"
1976,WS,"Worthington Steel, Inc. Common Shares",$46.46,2.05,4.616%,"2,360,429,802"
1977,UNFI,"United Natural Foods, Inc. Common Stock",$38.72,-0.63,-1.601%,"2,359,279,954"
1978,TENB,"Tenable Holdings, Inc. Common Stock",$19.72,-0.33,-1.646%,"2,353,468,926"
1979,TGLS,Tecnoglass Inc. Ordinary Shares,$50.46,1.76,3.614%,"2,349,894,245"
1980,NHC,National HealthCare Corporation Common Stock,$151.45,2.56,1.719%,"2,349,785,067"
1981,HLIO,"Helios Technologies, Inc. Common Stock",$70.73,1.16,1.667%,"2,343,178,381"
1982,SVM,Silvercorp Metals Inc. Common Shares,$10.62,-0.12,-1.117%,"2,339,705,836"
1983,ANDG,Andersen Group Inc. Class A Common Stock,$21.04,0.54,2.634%,"2,334,440,600"
1984,ATKR,Atkore Inc. Common Stock,$69.05,-0.84,-1.202%,"2,330,471,058"
1985,BUSE,First Busey Corporation Class A Common Stock,$26.34,0.60,2.331%,"2,328,694,193"
1986,ALRM,"Alarm.com Holdings, Inc. Common Stock",$46.45,0.85,1.864%,"2,316,911,136"
1987,MAZE,"Maze Therapeutics, Inc. Common Stock",$48.14,0.17,0.354%,"2,316,470,034"
1988,PK,Park Hotels & Resorts Inc. Common Stock,$11.55,0.48,4.336%,"2,308,825,111"
1989,HNI,HNI Corporation Common Stock,$50.30,1.43,2.926%,"2,305,312,428"
1990,BUSEP,"First Busey Corporation Depositary Shares, Each Representing a 1/40thInterest in a Share of 8.25% Fixed-Rate Series B Non-Cumulative Perpetual Preferred Stock, $0.001 par value",$26.03,-0.07,-0.268%,"2,301,287,389"
1991,SM,SM Energy Company Common Stock,$20.04,1.01,5.307%,"2,295,666,008"
1992,NEOG,Neogen Corporation Common Stock,$10.54,0.27,2.629%,"2,292,723,840"
1993,ADAMI,"Adamas Trust, Inc. 9.125% Senior Notes Due 2029",$25.28,0.03,0.119%,"2,289,848,471"
1994,BLKB,"Blackbaud, Inc. Common Stock",$47.85,-0.70,-1.442%,"2,288,865,465"
1995,RNG,"RingCentral, Inc. Class A Common Stock",$26.43,1.61,6.487%,"2,287,905,417"
1996,ADAMM,"Adamas Trust, Inc. 7.875% Series E Fixed-to-Floating Rate Cumulative Redeemable Preferred Stock",$25.33,-0.02,-0.079%,"2,287,642,956"
1997,FA,First Advantage Corporation Common Stock,$13.13,0.54,4.289%,"2,286,129,399"
1998,WT,"WisdomTree, Inc. Common Stock",$16.23,-0.22,-1.337%,"2,283,805,748"
1999,GLPG,Galapagos NV American Depositary Shares,$34.63,0.03,0.087%,"2,282,015,569"
2000,ASGN,ASGN Incorporated Common Stock,$53.28,2.51,4.944%,"2,275,056,000"
2001,AVPT,"AvePoint, Inc. Class A Common Stock",$10.53,-0.05,-0.473%,"2,272,261,466"
2002,PLUS,ePlus inc. Common Stock,$86.09,1.08,1.27%,"2,272,058,612"
2003,RCUS,"Arcus Biosciences, Inc. Common Stock",$20.99,-0.97,-4.417%,"2,266,364,521"
2004,CSGS,"CSG Systems International, Inc. Common Stock",$79.45,-0.24,-0.301%,"2,265,928,063"
2005,WERN,"Werner Enterprises, Inc. Common Stock",$37.83,0.65,1.748%,"2,263,380,892"
2006,SLNO,"Soleno Therapeutics, Inc. Common Stock",$42.12,-1.86,-4.229%,"2,262,266,253"
2007,NTB,Bank of N.T. Butterfield & Son Limited (The) Voting Ordinary Shares,$52.50,-0.21,-0.398%,"2,257,500,000"
2008,PTRN,Pattern Group Inc. Series A Common Stock,$12.80,-0.59,-4.406%,"2,255,679,014"
2009,KMPR,Kemper Corporation,$38.50,0.41,1.076%,"2,254,054,110"
2010,HI,Hillenbrand Inc Common Stock,$31.88,-0.01,-0.031%,"2,247,757,390"
2011,RGTIW,"Rigetti Computing, Inc. Warrants",$6.81,-0.78,-10.277%,"2,247,477,591"
2012,DHT,"DHT Holdings, Inc.",$13.94,-0.37,-2.586%,"2,238,178,213"
2013,KALU,Kaiser Aluminum Corporation Common Stock,$138.00,-0.86,-0.619%,"2,236,463,190"
2014,PAX,Patria Investments Limited Class A Common Shares,$13.99,-0.28,-1.962%,"2,230,965,042"
2015,UPWK,Upwork Inc. Common Stock,$17.05,-1.20,-6.575%,"2,227,665,755"
2016,MTX,Minerals Technologies Inc. Common Stock,$71.55,2.60,3.771%,"2,227,659,737"
2017,LASR,"nLIGHT, Inc. Common Stock",$43.86,-6.12,-12.245%,"2,227,474,267"
2018,NIC,Nicolet Bankshares Inc. Common Stock,$149.17,-0.49,-0.327%,"2,227,134,503"
2019,ETOR,eToro Group Ltd. Class A Common Shares,$26.54,-0.51,-1.885%,"2,221,503,842"
2020,PMTU,PennyMac Mortgage Investment Trust 8.50% Senior Notes due 2028,$25.46,-0.14,-0.547%,"2,215,442,738"
2021,TNK,Teekay Tankers Ltd.,$64.27,-0.87,-1.336%,"2,209,742,837"
2022,EFSC,Enterprise Financial Services Corporation Common Stock,$59.55,0.78,1.327%,"2,203,999,631"
2023,DAVE,Dave Inc. Class A Common Stock,$163.08,-6.92,-4.071%,"2,202,245,693"
2024,WD,"Walker & Dunlop, Inc Common Stock",$64.51,3.77,6.207%,"2,197,483,606"
2025,DXPE,"DXP Enterprises, Inc. Common Stock",$139.98,2.20,1.597%,"2,194,787,014"
2026,MESO,Mesoblast Limited American Depositary Shares,$16.99,-0.35,-2.018%,"2,193,072,921"
2027,EPAC,Enerpac Tool Group Corp. Common Stock,$41.48,-0.26,-0.623%,"2,189,161,131"
2028,CENT,Central Garden & Pet Company Common Stock,$35.11,0.63,1.827%,"2,188,501,308"
2029,ANDE,"Andersons, Inc. (The) Common Stock",$64.67,-0.56,-0.859%,"2,188,376,084"
2030,BRZE,"Braze, Inc. Class A Common Stock",$19.47,0.54,2.853%,"2,184,835,746"
2031,BANR,Banner Corporation Common Stock,$64.08,0.60,0.945%,"2,184,226,394"
2032,GEO,Geo Group Inc (The) REIT,$15.68,-0.07,-0.444%,"2,182,612,864"
2033,LU,"Lufax Holding Ltd American Depositary Shares, each representing two (2) Ordinary Shares",$2.51,-0.04,-1.569%,"2,175,266,400"
2034,EYE,"National Vision Holdings, Inc. Common Stock",$27.42,0.07,0.256%,"2,174,668,080"
2035,FIHL,Fidelis Insurance Holdings Limited Common Shares,$19.41,0.19,0.989%,"2,169,520,510"
2036,JBLU,JetBlue Airways Corporation Common Stock,$5.96,0.39,7.002%,"2,167,715,891"
2037,NOVTU,Novanta Inc. Tangible Equity Units,$60.42,0.25,0.415%,"2,161,532,932"
2038,ASAN,"Asana, Inc. Class A Common Stock",$9.10,-0.15,-1.622%,"2,157,610,009"
2039,NCNO,"nCino, Inc. Common Stock",$18.81,0.10,0.534%,"2,157,224,248"
2040,OGN,Organon & Co. Common Stock,$8.29,0.29,3.625%,"2,155,258,340"
2041,IOSP,Innospec Inc. Common Stock,$86.89,2.93,3.49%,"2,152,924,100"
2042,PAYO,Payoneer Global Inc. Common Stock,$6.04,0.11,1.855%,"2,152,899,436"
2043,TIC,"TIC Solutions, Inc. Common Stock",$9.73,-0.17,-1.717%,"2,152,370,245"
2044,HRMY,"Harmony Biosciences Holdings, Inc. Common Stock",$37.32,-0.16,-0.427%,"2,149,496,081"
2045,GTM,ZoomInfo Technologies Inc Common Stock,$6.87,-0.05,-0.723%,"2,140,640,709"
2046,SAH,"Sonic Automotive, Inc. Common Stock",$62.58,2.38,3.953%,"2,138,526,565"
2047,CLMT,"Calumet, Inc. Common Stock",$24.51,0.52,2.168%,"2,126,348,408"
2048,FMC,FMC Corporation Common Stock,$16.99,0.94,5.857%,"2,122,391,938"
