,Ticker,Name,Last Sale,Net Change,% Change,Market Cap
5335,BANL,CBL International Limited Class B Ordinary Shares,$0.3451,0.0263,8.25%,"9,490,250"
5336,PULM,"Pulmatrix, Inc. Common Stock",$2.5691,-0.0309,-1.188%,"9,383,085"
5337,MARPS,Marine Petroleum Trust Units of Beneficial Interest,$4.69,-0.07,-1.471%,"9,380,000"
5338,SUGP,SU Group Holdings Limited Ordinary Shares,$6.36,0.165,2.663%,"9,315,950"
5339,HSCS,HeartSciences Inc. Common Stock,$2.93,-0.25,-7.862%,"9,312,147"
5340,GFAI,"Guardforce AI Co., Limited Ordinary Shares",$0.4426,-0.0234,-5.021%,"9,305,013"
5341,WLDS,Wearable Devices Ltd. Ordinary Share,$0.90,-0.02,-2.174%,"9,286,565"
5342,ICU,SeaStar Medical Holding Corporation Common Stock,$2.57,0.12,4.898%,"9,264,112"
5343,BLIN,"Bridgeline Digital, Inc. Common Stock",$0.7545,-0.0256,-3.282%,"9,223,309"
5344,GELS,Gelteq Limited Ordinary Shares,$0.8607,0.0126,1.486%,"9,219,008"
5345,SXTC,"China SXT Pharmaceuticals, Inc. Ordinary Shares",$3.94,-0.59,-13.024%,"9,142,947"
5346,BRTX,"BioRestorative Therapies, Inc. Common Stock (NV)",$1.03,-0.07,-6.364%,"9,142,529"
5347,EDSA,"Edesa Biotech, Inc. Common Shares",$1.09,-0.05,-4.386%,"9,083,867"
5348,SCKT,"Socket Mobile, Inc. Common Stock",$1.125,UNCH,--,"8,973,520"
5349,HKPD,"Cellyan Biotechnology Co., Ltd Class A Ordinary Shares",$0.81,0.041,5.332%,"8,910,000"
5350,MTR,Mesa Royalty Trust Common Stock,$4.78,-0.02,-0.417%,"8,907,960"
5351,SOS,SOS Limited Class A Ordinary Shares,$1.31,-0.06,-4.38%,"8,899,975"
5352,TVGNW,Tevogen Bio Holdings Inc. Warrant,$0.0441,-0.0003,-0.676%,"8,882,502"
5353,AMST,Amesite Inc. Common Stock,$1.94,-0.01,-0.513%,"8,871,063"
5354,TGHL,The GrowHub Limited Class A Ordinary Shares,$0.35,-0.0549,-13.559%,"8,854,934"
5355,QNCX,"Quince Therapeutics, Inc. Common Stock",$0.1589,0.0135,9.285%,"8,847,789"
5356,AGPU,Axe Compute Inc. Common Stock,$2.59,-0.10,-3.717%,"8,789,206"
5357,DAIC,"CID HoldCo, Inc. Common Stock",$0.2997,-0.0347,-10.377%,"8,773,215"
5358,BIVI,BioVie Inc. Class A Common Stock,$1.16,-0.03,-2.521%,"8,746,767"
5359,CUPR,Cuprina Holdings (Cayman) Limited Class A Ordinary Shares,$0.4154,-0.0192,-4.418%,"8,723,400"
5360,CETY,"Clean Energy Technologies, Inc. Common Stock",$0.541,-0.0351,-6.093%,"8,715,988"
5361,INEO,INNEOVA Holdings Limited Class A Ordinary Shares,$0.536,0.0204,3.957%,"8,667,454"
5362,TBLAW,Taboola.com Ltd. Warrant,$0.03,-0.006,-16.667%,"8,646,701"
5363,PRSO,Peraso Inc. Common Stock,$0.8285,-0.0342,-3.964%,"8,605,555"
5364,TURB,"Turbo Energy, S.A. American Depositary Shares",$0.78,UNCH,--,"8,593,369"
5365,DTSS,Datasea Inc. Common Stock,$1.00,-0.10,-9.091%,"8,570,713"
5366,DSS,"DSS, Inc. Common Stock",$0.94,-0.45,-32.374%,"8,546,967"
5367,MNTS,Momentus Inc. Class A Common Stock,$6.11,-0.46,-7.002%,"8,536,764"
5368,XHLD,"TEN Holdings, Inc. Common Stock",$2.87,0.30,11.673%,"8,532,025"
5369,HCAI,"Huachen AI Parking Management Technology Holding Co., Ltd. Class A Ordinary Shares",$0.244,-0.066,-21.29%,"8,514,990"
5370,ZKIN,"ZK International Group Co., Ltd Ordinary Share",$1.64,-0.03,-1.796%,"8,468,871"
5371,BFRG,"Bullfrog AI Holdings, Inc. Common Stock",$0.5549,-0.0121,-2.134%,"8,462,117"
5372,CMMB,Chemomab Therapeutics Ltd. American Depositary Share,$1.63,0.01,0.617%,"8,461,454"
5373,INBS,Intelligent Bio Solutions Inc. Common Stock,$6.955,-0.455,-6.14%,"8,458,268"
5374,FLYE,"Fly-E Group, Inc. Common Stock",$5.18,-0.24,-4.428%,"8,455,759"
5375,BOXL,Boxlight Corporation Class A Common Stock,$2.02,0.73,56.589%,"8,416,667"
5376,ETS,Elite Express Holding Inc. Class A Common Stock,$0.5033,-0.0086,-1.68%,"8,413,501"
5377,TBH,"Brag House Holdings, Inc. Common Stock",$0.4004,-0.0232,-5.477%,"8,388,926"
5378,CJMB,Callan JMB Inc. Common Stock,$1.80,-0.28,-13.462%,"8,321,449"
5379,FTFT,Future FinTech Group Inc. Common Stock,$1.64,-0.28,-14.583%,"8,279,258"
5380,SKYQ,Sky Quarry Inc. Common Stock,$0.3214,0.0514,19.037%,"8,188,101"
5381,CURX,Curanex Pharmaceuticals Inc Common Stock,$0.2888,-0.0127,-4.212%,"8,184,827"
5382,AGRZ,Agroz Inc. Ordinary Shares,$0.3995,-0.0637,-13.752%,"8,159,182"
5383,PHGE,BiomX Inc. COmmon Stock,$5.29,-0.42,-7.356%,"8,075,926"
5384,XELB,"Xcel Brands, Inc. Common Stock",$1.68,0.09,5.66%,"8,075,384"
5385,KPRX,"Kiora Pharmaceuticals, Inc.  Common Stock",$2.19,-0.07,-3.097%,"8,054,678"
5386,BBGI,"Beasley Broadcast Group, Inc. Class A Common Stock",$4.43,-0.38,-7.90%,"7,991,693"
5387,BCTX,BriaCell Therapeutics Corp. Common Shares,$4.22,-0.11,-2.54%,"7,950,083"
5388,AMZE,"Amaze Holdings, Inc. Common Stock",$0.398,-0.0326,-7.571%,"7,936,842"
5389,BTCT,BTC Digital Ltd. Ordinary Shares,$1.23,-0.03,-2.381%,"7,913,869"
5390,ALZN,"Alzamend Neuro, Inc. Common Stock",$2.08,-0.01,-0.478%,"7,907,336"
5391,RNAZ,"TransCode Therapeutics, Inc. Common Stock",$8.58,-0.40,-4.454%,"7,867,585"
5392,OXBR,Oxbridge Re Holdings Limited Ordinary Shares,$1.02,-0.0253,-2.42%,"7,829,644"
5393,JXG,JX Luxventure Group Inc. Common Stock,$4.17,-0.03,-0.714%,"7,783,814"
5394,SRTAW,"Strata Critical Medical, Inc. Warrants",$0.09,-0.0101,-10.09%,"7,772,987"
5395,ZOOZW,ZOOZ Strategy Ltd. Warrant,$0.048,UNCH,--,"7,771,190"
5396,TULP,"Bloomia Holdings, Inc. Common Stock",$4.38,UNCH,--,"7,766,261"
5397,CYCU,"Cycurion, Inc. Common Stock",$1.85,-0.18,-8.867%,"7,748,146"
5398,TNMG,TNL Mediagene Ordinary Shares,$3.03,-0.22,-6.769%,"7,744,053"
5399,WAFU,Wah Fu Education Group Limited Ordinary Shares,$1.75,0.07,4.167%,"7,718,478"
5400,NTCL,NETCLASS TECHNOLOGY INC Class A Ordinary Shares,$0.3502,-0.0099,-2.749%,"7,701,598"
5401,IOTR,iOThree Limited Ordinary Shares,$2.99,UNCH,--,"7,669,353"
5402,ABTS,Abits Group Inc Ordinary Shares,$3.23,-0.54,-14.324%,"7,655,549"
5403,PRHI,"Presurance Holdings, Inc. Common Stock",$0.6252,-0.0798,-11.319%,"7,641,745"
5404,AMBO,Ambow Education Holding Ltd. American Depository Shares (each representing twenty (20) Class A Ordinary Shares),$2.67,-0.1499,-5.316%,"7,626,524"
5405,MSN,Emerson Radio Corporation Common Stock,$0.3603,-0.0147,-3.92%,"7,581,668"
5406,LOBO,LOBO TECHNOLOGIES LTD. Class A Ordinary Shares,$0.599,-0.0009,-0.15%,"7,573,004"
5407,TNON,"Tenon Medical, Inc. Common Stock",$0.6813,-0.0769,-10.142%,"7,566,820"
5408,MKZR,"MacKenzie Realty Capital, Inc. Common Stock",$4.05,-0.25,-5.814%,"7,502,548"
5409,YJ,Yunji Inc. American Depository Shares,$1.52,-0.07,-4.403%,"7,486,821"
5410,BKYI,"BIO-key International, Inc. Common Stock",$0.6908,-0.0795,-10.321%,"7,485,936"
5411,RVYL,Ryvyl Inc. Common Stock,$5.88,0.27,4.813%,"7,447,790"
5412,PFSA,"Profusa, Inc. Common Stock",$0.0861,-0.0054,-5.902%,"7,440,271"
5413,AEHL,Antelope Enterprise Holdings Limited Class A Ordinary Shares,$0.7917,-0.0133,-1.652%,"7,322,337"
5414,CWD,CaliberCos Inc. Class A Common Stock,$1.12,-0.04,-3.448%,"7,318,437"
5415,ANY,Sphere 3D Corp. Common Shares,$0.2169,-0.011,-4.827%,"7,315,856"
5416,YMAT,"J-Star Holding Co., Ltd. Class A Ordinary Shares",$0.43,-0.031,-6.725%,"7,315,541"
5417,CCHH,CCH Holdings Ltd Ordinary Shares,$0.38,-0.005,-1.299%,"7,315,000"
5418,GURE,"Gulf Resources, Inc. (NV) Common Stock",$4.75,0.20,4.396%,"7,312,772"
5419,MYSE,"Myseum, Inc. Common Stock",$1.71,-0.14,-7.568%,"7,292,003"
5420,ONMDW,OneMedNet Corp Warrant,$0.1425,UNCH,--,"7,268,242"
5421,OLB,"The OLB Group, Inc. Common Stock",$0.5393,-0.0073,-1.336%,"7,245,180"
5422,XPON,Expion360 Inc. Common Stock,$0.7454,-0.024,-3.119%,"7,198,133"
5423,PMCB,"PharmaCyte  Biotech, Inc. Common Stock",$0.7072,-0.0778,-9.911%,"7,166,878"
5424,EVGN,Evogene Ltd Ordinary Shares,$1.09,0.05,4.808%,"7,100,902"
5425,ITOC,iTonic Holdings Ltd Class A Ordinary Shares,$0.3881,-0.0421,-9.786%,"7,082,825"
5426,NRSNW,NeuroSense Therapeutics Ltd. Warrant,$0.2131,-0.1669,-43.921%,"7,056,346"
5427,JTAI,Jet.AI Inc. Common Stock,$0.1542,-0.0116,-6.996%,"7,012,746"
5428,UCAR,U Power Limited Class A Ordinary Shares,$1.40,-0.04,-2.778%,"6,960,079"
5429,MITQ,"Moving iMage Technologies, Inc. Common Stock",$0.70,-0.02,-2.778%,"6,957,812"
5430,NWTG,"Newton Golf Company, Inc. Common Stock",$1.46,-0.06,-3.947%,"6,938,596"
5431,TGL,Treasure Global Inc. Common Stock,$4.54,-0.415,-8.375%,"6,929,693"
5432,CXAI,CXApp Inc. Class A Common Stock,$0.2169,-0.0455,-17.34%,"6,918,227"
5433,BMRA,"Biomerica, Inc. Common Stock",$2.29,-0.05,-2.137%,"6,915,953"
5434,CELZ,"Creative Medical Technology Holdings, Inc. Common Stock",$1.97,-0.03,-1.50%,"6,884,496"
5435,MSS,Maison Solutions Inc. Class A Common Stock,$0.2715,0.0084,3.193%,"6,849,851"
5436,CLDI,"Calidi Biotherapeutics, Inc. Common Stock",$0.9547,-0.0287,-2.918%,"6,843,023"
5437,HYFM,"Hydrofarm Holdings Group, Inc. Common Stock",$1.46,-0.08,-5.195%,"6,813,826"
5438,NCRA,"Nocera, Inc. Common Stock",$0.4737,-0.0675,-12.472%,"6,808,782"
5439,OLOX,Olenox Industries Inc. Common Stock,$1.09,-0.09,-7.627%,"6,738,119"
5440,JYD,Jayud Global Logistics Limited Class A Ordinary Shares,$2.46,-0.36,-12.766%,"6,725,318"
5441,ATER,"Aterian, Inc. Common Stock",$0.6683,0.0179,2.752%,"6,701,075"
5442,JCTC,Jewett-Cameron Trading Company Common Shares,$1.90,-0.09,-4.523%,"6,688,215"
5443,FAMI,"Farmmi, Inc. Ordinary Shares",$1.22,-0.05,-3.937%,"6,687,886"
5444,GV,Visionary Holdings Inc. Common Shares,$1.19,-0.03,-2.459%,"6,672,744"
5445,ERNA,Ernexa Therapeutics Inc. Common Stock,$0.8475,-0.0726,-7.89%,"6,651,933"
5446,ORKT,Orangekloud Technology Inc. Class A Ordinary Shares,$1.12,0.08,7.692%,"6,540,520"
5447,MIMI,Mint Incorporation Limited Class A Ordinary Shares,$0.2606,0.0036,1.401%,"6,518,258"
5448,CHR,"Cheer Holding, Inc. Class A Ordinary Share",$1.25,0.03,2.459%,"6,482,749"
5449,SSKN,"Strata Skin Sciences, Inc. Common Stock",$1.10,-0.09,-7.563%,"6,477,019"
5450,YAAS,Youxin Technology Ltd Class A Ordinary shares,$1.39,0.02,1.46%,"6,447,098"
5451,EHGO,Eshallgo Inc. Class A Ordinary Shares,$0.216,-0.0085,-3.786%,"6,413,939"
5452,RMSG,Real Messenger Corporation Ordinary Shares,$0.6664,0.0064,0.97%,"6,378,302"
5453,NAAS,NaaS Technology Inc. American Depositary Shares,$2.727,-0.163,-5.64%,"6,369,009"
5454,SOWG,Sow Good Inc. Common Stock,$0.521,-0.059,-10.172%,"6,368,495"
5455,FMFC,Kandal M Venture Limited Class A Ordinary Shares,$0.3325,-0.0185,-5.271%,"6,357,400"
5456,IVDA,"Iveda Solutions, Inc. Common Stock",$0.5603,-0.0199,-3.43%,"6,339,527"
5457,AMPGZ,"Amplitech Group, Inc. Series B Right",$0.251,-0.048,-16.054%,"6,320,506"
5458,AMPGR,"Amplitech Group, Inc. Series A Right",$0.25,-0.07,-21.875%,"6,295,325"
5459,GRRRW,Gorilla Technology Group Inc. Warrant,$0.31,-0.0073,-2.301%,"6,268,895"
5460,TPET,Trio Petroleum Corp. Common Stock,$0.5096,-0.1504,-22.788%,"6,268,463"
5461,IFBD,"Infobird Co., Ltd Ordinary Shares",$0.765,-0.0301,-3.786%,"6,264,259"
5462,TOVX,"Theriva Biologics, Inc. Common Stock",$0.175,-0.009,-4.891%,"6,245,461"
5463,HTCR,"Heartcore Enterprises, Inc. Common Stock",$0.2448,-0.0152,-5.846%,"6,222,769"
5464,AZI,Autozi Internet Technology (Global) Ltd. Class A Ordinary Shares,$1.93,-0.13,-6.311%,"6,221,975"
5465,NVNO,enVVeno Medical Corporation Common Stock,$9.39,-0.84,-8.211%,"6,156,140"
5466,OFAL,OFA Group Class A Ordinary Shares,$0.4327,-0.0087,-1.971%,"6,154,556"
5467,DTCK,Davis Commodities Limited Class A Ordinary Shares,$0.2243,-0.016,-6.658%,"6,139,242"
5468,HTOO,Fusion Fuel Green PLC Class A Ordinary Shares,$3.39,0.11,3.354%,"6,137,822"
5469,VIVS,"VivoSim Labs, Inc. Common Stock",$2.35,-0.40,-14.545%,"6,128,711"
5470,ELPW,Elong Power Holding Limited Class A Ordinary Shares,$1.45,0.5499,61.093%,"6,098,638"
5471,CRE,Cre8 Enterprise Limited Class A Ordinary Shares,$0.2528,-0.0272,-9.714%,"6,073,520"
5472,CNEY,CN Energy Group Inc. Class A Ordinary Shares,$1.06,0.03,2.913%,"5,961,181"
5473,SNTG,Sentage Holdings Inc. Class A Ordinary Shares,$2.12,UNCH,--,"5,947,289"
5474,APM,Aptorum Group Limited Class A Ordinary Shares,$0.83,-0.0499,-5.671%,"5,929,318"
5475,GNLN,"Greenlane Holdings, Inc. Class A Common Stock",$1.22,-0.06,-4.688%,"5,892,067"
5476,NIVF,NewGenIvf Group Limited Class A Ordinary Shares,$0.891,-0.389,-30.391%,"5,871,492"
5477,KLTOW,"Klotho Neurosciences, Inc. Warrant",$0.0797,-0.0153,-16.105%,"5,860,877"
5478,HXHX,Haoxin Holdings Limited Class A Ordinary Shares,$0.4262,-0.0212,-4.738%,"5,860,250"
5479,EDHL,Everbright Digital Holding Limited Ordinary Shares,$0.2195,-0.0017,-0.769%,"5,851,870"
5480,HUBC,Hub Cyber Security Ltd. Ordinary Shares,$2.66,0.08,3.101%,"5,808,732"
5481,VS,Versus Systems Inc. Common Stock,$1.185,-0.0247,-2.042%,"5,808,487"
5482,FLDDW,"Fold Holdings, Inc. Warrant",$0.118,0.0069,6.211%,"5,801,004"
5483,MGRX,"Mangoceuticals, Inc. Common Stock",$0.3559,-0.0351,-8.977%,"5,797,183"
5484,ILAG,Intelligent Living Application Group Inc. Ordinary Shares,$2.78,-0.02,-0.714%,"5,775,305"
5485,MEGL,Magic Empire Global Limited Class A Ordinary Shares,$1.14,-0.04,-3.39%,"5,773,017"
5486,SQFTP,"Presidio Property Trust, Inc. 9.375% Series D Cumulative Redeemable Perpetual Preferred Stock, $0.01 par value per share",$4.00,-0.4999,-11.109%,"5,756,396"
5487,AGMH,AGM Group Holdings Inc. Class A Ordinary Shares,$1.64,0.04,2.50%,"5,738,247"
5488,ADVB,Advanced Biomed Inc. Common Stock,$0.2646,-0.0126,-4.545%,"5,725,944"
5489,BHAT,Blue Hat Interactive Entertainment Technology Ordinary Shares,$0.7885,-0.0109,-1.364%,"5,711,840"
5490,JCSE,JE Cleantech Holdings Limited Ordinary Shares,$1.07,-0.08,-6.957%,"5,628,478"
5491,LUCY,"Innovative Eyewear, Inc. Common Stock",$1.05,-0.07,-6.25%,"5,617,692"
5492,NCT,Intercont (Cayman) Limited Class A Ordinary shares,$0.1916,-0.0164,-7.885%,"5,616,844"
5493,IPDN,"Professional Diversity Network, Inc. Common Stock",$1.15,-0.01,-0.862%,"5,614,257"
5494,SBFM,Sunshine Biopharma Inc. Common Stock,$1.21,-0.02,-1.626%,"5,512,693"
5495,BEATW,"Heartbeam, Inc. Warrant",$0.16,0.0048,3.093%,"5,510,970"
5496,TIRX,TIAN RUIXIANG Holdings Ltd Class A Ordinary Shares,$0.1256,-0.0244,-16.267%,"5,502,985"
5497,GIBO,GIBO Holdings Limited Class A Ordinary Shares,$1.46,-0.06,-3.947%,"5,482,791"
5498,FCUV,Focus Universal Inc. Common Stock,$0.667,-0.081,-10.829%,"5,477,207"
5499,DRMA,"Dermata Therapeutics, Inc. Common Stock",$1.93,0.09,4.891%,"5,472,212"
5500,TCRT,"Alaunos Therapeutics, Inc. Common Stock",$2.45,-0.13,-5.039%,"5,467,981"
5501,SKK,SKK Holdings Limited Ordinary Shares,$0.2908,-0.0164,-5.339%,"5,452,500"
5502,IMRN,Immuron Limited American Depositary Shares,$0.8125,-0.0289,-3.435%,"5,448,218"
5503,SNOA,"Sonoma Pharmaceuticals, Inc. Common Stock",$3.20,-0.03,-0.929%,"5,443,443"
5504,RDHL,Redhill Biopharma Ltd. American Depositary Shares,$1.06,-0.06,-5.357%,"5,419,658"
5505,ASTC,Astrotech Corporation (DE) Common Stock,$3.08,-0.05,-1.597%,"5,417,575"
5506,SLXN,Silexion Therapeutics Corp Ordinary Shares,$1.73,-0.04,-2.26%,"5,409,091"
5507,STAI,ScanTech AI Systems Inc. Common stock,$1.43,-0.08,-5.298%,"5,406,338"
5508,SYNX,Silynxcom Ltd. Ordinary Shares,$1.02,-0.02,-1.923%,"5,392,722"
5509,PCSA,"Processa Pharmaceuticals, Inc. Common Stock",$2.38,-0.06,-2.459%,"5,392,530"
5510,ASBP,"Aspire Biopharma Holdings, Inc. Common Stock",$1.55,-0.08,-4.908%,"5,364,787"
5511,ACXP,"Acurx Pharmaceuticals, Inc. Common Stock",$2.10,-0.18,-7.895%,"5,348,106"
5512,AEVAW,"Aeva Technologies, Inc. Warrants",$0.0886,-0.0066,-6.933%,"5,323,080"
5513,EEIQ,EpicQuest Education Group International Limited Common Stock,$0.2244,-0.0024,-1.058%,"5,311,922"
5514,MOBXW,"Mobix Labs, Inc Warrants",$0.08,0.0105,15.108%,"5,305,035"
5515,TDIC,Dreamland Limited Class A Ordinary Shares,$0.1707,-0.0183,-9.683%,"5,291,700"
5516,LGCL,Lucas GC Limited Ordinary Shares,$1.89,-0.18,-8.696%,"5,273,905"
5517,KWMWW,"K Wave Media, Ltd. Warrant",$0.0698,-0.0001,-0.143%,"5,269,849"
5518,JDZG,JIADE LIMITED Class A Ordinary Shares,$1.56,UNCH,--,"5,255,930"
5519,RIME,"Algorhythm Holdings, Inc. Common Stock",$0.9102,-0.0869,-8.715%,"5,241,024"
5520,GLE,Global Engine Group Holding Limited Class A Ordinary Shares,$0.2849,-0.0241,-7.799%,"5,213,670"
5521,LXEH,"Lixiang Education Holding Co., Ltd. American Depositary Shares",$0.2694,-0.0289,-9.688%,"5,163,501"
5522,MRNOW,Murano Global Investments PLC Warrants,$0.0651,0.0001,0.154%,"5,162,803"
5523,SDAWW,SunCar Technology Group Inc. Warrant,$0.0524,0.0081,18.284%,"5,161,665"
5524,MBIO,"Mustang Bio, Inc. Common Stock",$0.704,-0.075,-9.628%,"5,138,557"
5525,DAVEW,Dave Inc. Warrants,$0.38,-0.027,-6.634%,"5,131,551"
5526,GNPX,"Genprex, Inc. Common Stock",$2.21,-0.19,-7.917%,"5,124,756"
5527,WALDW,Waldencast plc Warrant,$0.04,UNCH,--,"5,121,649"
5528,SILO,"Silo Pharma, Inc. Common Stock",$0.3109,-0.0081,-2.539%,"5,095,558"
5529,PASW,"Ping An Biomedical Co., Ltd. Ordinary Shares",$0.2066,-0.007,-3.277%,"5,072,030"
5530,NCPL,Netcapital Inc. Common Stock,$0.6445,-0.0454,-6.581%,"5,057,971"
5531,SONM,"Sonim Technologies, Inc. Common Stock",$4.915,-0.485,-8.981%,"5,056,026"
5532,CAPS,Capstone Holding Corp. Common Stock,$0.556,-0.027,-4.631%,"5,052,857"
5533,ABP,"Abpro Holdings, Inc Common Stock",$1.86,-0.04,-2.105%,"5,052,277"
5534,FFAIW,Faraday Future Intelligent Electric Inc. Warrant,$0.0253,-0.0047,-15.667%,"5,016,971"
5535,VEEAW,Veea Inc. Warrant,$0.10,-0.0079,-7.322%,"5,016,067"
5536,NUWE,"Nuwellis, Inc. Common Stock",$3.02,-0.87,-22.365%,"5,009,573"
5537,XBIO,"Xenetic Biosciences, Inc. Common Stock",$2.18,0.006,0.276%,"4,994,502"
5538,DUO,Fangdd Network Group Ltd. Class A Ordinary Shares,$1.27,0.005,0.395%,"4,950,217"
5539,HCWC,Healthy Choice Wellness Corp. Class A Common Stock,$0.2717,-0.0082,-2.93%,"4,935,634"
5540,APVO,Aptevo Therapeutics Inc. Common Stock,$6.41,-0.35,-5.178%,"4,917,521"
5541,GOVX,"GeoVax Labs, Inc. Common Stock",$2.82,0.19,7.224%,"4,884,655"
5542,JWEL,Jowell Global Ltd. Ordinary Shares,$2.25,-0.04,-1.747%,"4,883,569"
5543,CYCN,"Cyclerion Therapeutics, Inc. Common Stock",$1.24,UNCH,--,"4,867,389"
5544,LCFY,Locafy Limited Ordinary Share,$2.70,0.05,1.887%,"4,857,449"
5545,YDKG,Yueda Digital Holding Class A Ordinary Share,$0.87,-0.0003,-0.034%,"4,821,735"
5546,NISN,"NiSun International Enterprise Development Group Co., Ltd. Class A Common Shares",$1.00,-0.01,-0.99%,"4,798,358"
5547,LCFYW,Locafy Limited Warrant,$2.65,0.47,21.56%,"4,767,496"
5548,BTMWW,Bitcoin Depot Inc. Warrant,$0.0646,0.0082,14.539%,"4,737,898"
5549,CHNR,"China Natural Resources, Inc. Common Stock",$3.81,-0.04,-1.039%,"4,698,572"
5550,NCI,Neo-Concept International Group Holdings Limited Class A Ordinary Shares,$1.155,-0.0982,-7.836%,"4,693,920"
5551,APRE,"Aprea Therapeutics, Inc. Common stock",$0.67,-0.0033,-0.49%,"4,685,871"
5552,ATON,AlphaTON Capital Corp. Common Stock,$0.51,-0.09,-15.00%,"4,633,140"
5553,SXTP,"60 Degrees Pharmaceuticals, Inc. Common Stock",$4.38,0.36,8.955%,"4,632,341"
5554,SLE,"Super League Enterprise, Inc. Common Stock",$4.80,-0.33,-6.433%,"4,596,821"
5555,NCNA,NuCana plc American Depositary Share,$2.38,-0.02,-0.833%,"4,541,464"
5556,NDRA,ENDRA Life Sciences Inc. Common Stock,$3.89,0.21,5.707%,"4,537,455"
5557,SDOT,Sadot Group Inc. Common Stock,$2.91,-0.04,-1.356%,"4,507,823"
5558,LMFA,"LM Funding America, Inc. Common Stock",$0.3189,-0.0197,-5.818%,"4,503,983"
5559,PDYNW,Palladyne AI Corp Warrants,$0.1005,-0.0294,-22.633%,"4,493,297"
5560,MSAIW,"MultiSensor AI Holdings, Inc. Warrant",$0.0559,UNCH,--,"4,479,456"
5561,GCLWW,GCL Global Holdings Ltd Warrants,$0.0351,-0.0039,-10.00%,"4,433,770"
5562,BAOS,Baosheng Media Group Holdings Limited Ordinary shares,$2.87,-0.14,-4.651%,"4,403,978"
5563,STAK,STAK Inc. Class A Ordinary Shares,$0.332,-0.0483,-12.70%,"4,385,836"
5564,XTKG,"X3 Holdings Co., Ltd. Ordinary Shares",$0.27,-0.1375,-33.742%,"4,376,649"
5565,VSME,VS Media Holdings Limited Class A Ordinary Shares,$1.59,-0.09,-5.357%,"4,373,588"
5566,ADIL,"Adial Pharmaceuticals, Inc Common Stock",$0.1568,-0.0545,-25.793%,"4,355,788"
5567,CDTG,CDT Environmental Technology Investment Holdings Limited ordinary shares,$0.3529,0.002,0.57%,"4,349,493"
5568,SHPH,"Shuttle Pharmaceuticals Holdings, Inc. Common Stock",$1.61,-0.23,-12.50%,"4,318,387"
5569,BIYA,Baiya International Group Inc. Ordinary Shares,$3.57,-0.35,-8.929%,"4,318,304"
5570,ULY,Urgent.ly Inc. Common Stock,$1.97,-0.44,-18.257%,"4,316,162"
5571,TWAV,"TaoWeave, Inc. Common Stock",$1.34,-0.10,-6.944%,"4,297,661"
5572,HIHO,Highway Holdings Limited Common Stock,$0.9301,0.0001,0.011%,"4,280,157"
5573,WAI,Top KingWin Ltd Class A Ordinary Shares,$2.57,-0.03,-1.154%,"4,256,236"
5574,TWG,Top Wealth Group Holding Limited Class A Ordinary Shares,$3.66,-0.09,-2.40%,"4,245,812"
5575,BGLC,BioNexus Gene Lab Corp Common stock,$2.35,-0.30,-11.321%,"4,221,791"
5576,KIDZ,"Classover Holdings, Inc. Class B Common Stock",$0.1503,-0.0103,-6.413%,"4,212,688"
5577,DEVS,DevvStream Corp. Common Stock,$0.9598,-0.0002,-0.021%,"4,203,936"
5578,WHLRP,"Wheeler Real Estate Investment Trust, Inc. Class B Preferred Stock",$6.05,UNCH,--,"4,203,891"
5579,ATPC,Agape ATP Corporation Common Stock,$0.084,0.005,6.329%,"4,202,268"
5580,BTOG,Bit Origin Limited Class A Ordinary Shares,$2.84,0.06,2.158%,"4,194,231"
5581,REVB,"Revelation Biosciences, Inc. Common Stock",$1.59,-0.08,-4.79%,"4,170,758"
5582,VSTD,Vestand Inc. Class A Common Stock,$0.2928,-0.0252,-7.925%,"4,165,074"
5583,GLXG,Galaxy Payroll Group Limited Class A Ordinary Shares,$1.92,-0.05,-2.538%,"4,149,629"
5584,POLA,"Polar Power, Inc. Common Stock",$1.54,-0.04,-2.532%,"4,094,361"
5585,FRSX,Foresight Autonomous Holdings Ltd. American Depositary Shares,$0.9351,-0.1049,-10.087%,"4,089,319"
5586,MTNB,"Matinas Biopharma Holdings, Inc. Common Stock",$0.6324,0.0423,7.168%,"4,051,275"
5587,DCOY,Decoy Therapeutics Inc. Common Stock,$0.63,-0.052,-7.625%,"4,022,032"
5588,SCAGW,Scage Future Warrants,$0.0553,-0.0007,-1.25%,"4,015,314"
5589,INDP,"Indaptus Therapeutics, Inc. Common Stock",$1.79,-0.06,-3.243%,"4,013,760"
5590,IPW,iPower Inc. Common Stock,$3.82,0.11,2.965%,"4,010,358"
5591,MASK,3 E Network Technology Group Ltd Class A Ordinary Shares,$0.229,0.003,1.327%,"3,991,037"
5592,WXM,WF International Limited Ordinary Shares,$0.4597,-0.0036,-0.777%,"3,962,930"
5593,GWAV,"Greenwave Technology Solutions, Inc. Common Stock",$4.77,-0.03,-0.625%,"3,957,340"
5594,SBLX,"StableX Technologies, Inc. Common Stock",$2.71,0.05,1.88%,"3,945,692"
5595,LVROW,Lavoro Limited Warrant,$0.0344,0.0087,33.852%,"3,942,083"
5596,BQ,Boqii Holding Limited Class A Ordinary Shares,$1.41,-0.06,-4.082%,"3,933,471"
5597,ATXG,Addentax Group Corp. Common Stock,$0.3328,0.0028,0.848%,"3,898,868"
5598,MLEC,Moolec Science SA Ordinary Shares,$5.35,0.27,5.315%,"3,884,731"
5599,NCL,Northann Corp. Common Stock,$0.1699,-0.0084,-4.711%,"3,864,053"
5600,ICON,Icon Energy Corp. Common stock,$1.54,-0.19,-10.983%,"3,863,044"
5601,ASNS,"Actelis Networks, Inc. Common Stock",$0.478,-0.0058,-1.199%,"3,851,911"
5602,BIAF,"bioAffinity Technologies, Inc. Common Stock",$0.8554,-0.2146,-20.056%,"3,848,196"
5603,BLUWW,Blue Water Acquisition Corp. III Warrant.,$0.5301,UNCH,--,"3,840,575"
5604,FUSEW,Fusemachines Inc. Warrants,$0.132,-0.001,-0.752%,"3,819,851"
5605,GRI,"GRI Bio, Inc. Common Stock",$2.64,0.04,1.538%,"3,814,877"
5606,SUNE,"SUNation Energy, Inc. Common Stock",$1.11,0.3266,41.69%,"3,781,342"
5607,AMODW,"Alpha Modus Holdings, Inc. Warrant",$0.09,-0.041,-31.298%,"3,776,396"
5608,CTNT,Cheetah Net Supply Chain Service Inc. Class A Common Stock,$1.15,0.11,10.577%,"3,765,775"
5609,AIHS,Senmiao Technology Limited Common Stock,$1.17,0.01,0.862%,"3,752,762"
5610,OUSTZ,"Ouster, Inc. Warrants",$0.0624,-0.0025,-3.852%,"3,744,326"
5611,GBR,"New Concept Energy, Inc Common Stock",$0.7225,-0.0681,-8.614%,"3,707,822"
5612,IMCC,IM Cannabis Corp. Common Shares,$1.19,-0.02,-1.653%,"3,671,688"
5613,STFS,Star Fashion Culture Holdings Limited Class A Ordinary Shares,$0.108,-0.006,-5.263%,"3,666,600"
5614,CPHI,"China Pharma Holdings, Inc. Common Stock",$0.7281,-0.1819,-19.989%,"3,656,520"
5615,DFSC,DEFSEC Technologies Inc. Common Stock,$1.81,-0.08,-4.233%,"3,608,463"
5616,MIGI,Mawson Infrastructure Group Inc. Common Stock,$3.15,-0.42,-11.765%,"3,601,266"
5617,ITP,"IT Tech Packaging, Inc. Common Stock",$0.2105,-0.0063,-2.906%,"3,571,221"
5618,EUDAW,EUDA Health Holdings Limited Warrant,$0.0944,-0.0016,-1.667%,"3,569,027"
5619,ONFO,Onfolio Holdings Inc. Common Stock,$0.606,-0.0513,-7.805%,"3,556,108"
5620,SOAR,"Volato Group, Inc. Class A Common Stock",$0.475,-0.1361,-22.271%,"3,548,220"
5621,GIPR,Generation Income Properties Inc. Common Stock,$0.65,-0.0226,-3.36%,"3,541,052"
5622,GLMD,Galmed Pharmaceuticals Ltd. Ordinary Shares,$0.635,-0.035,-5.224%,"3,479,312"
5623,AIM,AIM ImmunoTech Inc. Common Stock,$1.055,-0.095,-8.261%,"3,456,628"
5624,HCWB,HCW Biologics Inc. Common Stock,$1.05,-0.06,-5.405%,"3,443,803"
5625,AQB,"AquaBounty Technologies, Inc. Common Stock",$0.8851,-0.0449,-4.828%,"3,432,148"
5626,XRTX,XORTX Therapeutics Inc. Common Stock,$0.49,-0.0124,-2.468%,"3,411,487"
5627,FEED,"ENvue Medical, Inc. Common Stock",$3.12,0.66,26.829%,"3,395,109"
5628,BYAH,"Park Ha Biological Technology Co., Ltd. Ordinary Shares",$0.10,0.0213,27.065%,"3,387,440"
5629,ASPSW,Altisource Portfolio Solutions S.A. Net Settle Stakeholder Warrants,$0.3049,0.0241,8.583%,"3,351,933"
5630,LYRA,"Lyra Therapeutics, Inc. Common Stock",$1.885,-0.095,-4.798%,"3,345,653"
5631,FCHL,Fitness Champs Holdings Limited Common Stock,$0.2222,-0.0199,-8.22%,"3,333,000"
5632,PBM,Psyence Biomedical Ltd. Common Shares,$3.24,0.15,4.854%,"3,311,853"
5633,RKDA,"Arcadia Biosciences, Inc. Common Stock",$1.90,-0.07,-3.553%,"3,286,780"
5634,SMTK,"SmartKem, Inc. Common Stock",$0.48,-0.10,-17.241%,"3,283,051"
5635,BDRX,Biodexa Pharmaceuticals plc American Depositary Shs,$1.45,-0.18,-11.043%,"3,270,102"
5636,CNET,ZW Data Action Technologies Inc. Common Stock,$1.00,-0.08,-7.407%,"3,268,469"
5637,VMAR,Vision Marine Technologies Inc. Common Shares,$3.28,UNCH,--,"3,267,005"
5638,EZRA,"Reliance Global Group, Inc. Common Stock",$0.176,-0.015,-7.853%,"3,261,995"
5639,RVSNW,Rail Vision Ltd. Warrant,$0.055,-0.0122,-18.155%,"3,248,579"
5640,CNSP,"CNS Pharmaceuticals, Inc. Common Stock",$5.21,-0.14,-2.617%,"3,231,711"
5641,SQFT,"Presidio Property Trust, Inc. Class A Common Stock",$2.24,-0.21,-8.571%,"3,223,582"
5642,SGLY,Singularity Future Technology Ltd. Common Stock,$0.44,-0.0469,-9.632%,"3,209,136"
